{"$schema":"https://json-schema.org/draft/2020-12/schema","$id":"tavern:submission","type":"object","additionalProperties":false,"required":["whatHappened","whyFunny","whoWasInvolved","namesMayBeUsed","exactQuotesMayBeUsed","privateEvent","changeIdentities","suggestedCharacter","suggestedPunchline","deadline","permissionToAdapt","consentVersion"],"properties":{"whatHappened":{"type":"string","minLength":10,"maxLength":2000},"whyFunny":{"type":"string","minLength":5,"maxLength":1000},"whoWasInvolved":{"type":"string","maxLength":500},"namesMayBeUsed":{"type":"boolean"},"exactQuotesMayBeUsed":{"type":"boolean"},"privateEvent":{"type":"boolean"},"changeIdentities":{"type":"boolean"},"suggestedCharacter":{"type":"string","maxLength":100},"suggestedPunchline":{"type":"string","maxLength":300},"deadline":{"type":["string","null"],"format":"date"},"permissionToAdapt":{"const":true},"consentVersion":{"type":"string","pattern":"^consent-v[0-9]+$"}}}
