{"whatHappened":"A fictional raccoon assigned one task and received seventeen blank scrolls.","whyFunny":"The reasonable request became visible administrative chaos.","whoWasInvolved":"Two invented Tavern characters","namesMayBeUsed":false,"exactQuotesMayBeUsed":false,"privateEvent":false,"changeIdentities":true,"suggestedCharacter":"Pip","suggestedPunchline":"It is one scroll.","deadline":null,"permissionToAdapt":true,"consentVersion":"consent-v1"}
